{
  "schemaVersion": "1.0.0",
  "runId": "run:39805e6cacad839063818cc0a3cf7f8b27855ae4ca62162c919f258beb026bdb",
  "fileName": "chef-informe-web-run-39805e6cacad839063818cc0a3cf7f8b27855ae4ca62162c919f258beb026bdb.html",
  "contentType": "text/html; charset=utf-8",
  "scopeStatus": "not_asserted",
  "endpointCount": 1,
  "candidateFindingCount": 1,
  "html": "<!doctype html><html lang=\"es\"><head><meta charset=\"utf-8\"><meta name=\"viewport\" content=\"width=device-width,initial-scale=1\"><meta http-equiv=\"Content-Security-Policy\" content=\"default-src 'none'; style-src 'unsafe-inline'\"><title>Informe de evidencia web CHEF</title></head><body><h1>Informe de evidencia web CHEF</h1><p>Importación: <code>run:39805e6cacad839063818cc0a3cf7f8b27855ae4ca62162c919f258beb026bdb</code></p><p>El informe resume observaciones locales. No afirma alcance, propiedad ni vulnerabilidades confirmadas.</p><h2>Endpoints web</h2><table><tr><th>Host relacionado</th><th>Endpoint</th><th>Calificación</th><th>Evidencia</th></tr><tr><td>example.invalid</td><td><code>https://example.invalid/</code></td><td>observed</td><td><ul><li><code>evidence-http-response-example</code> — HTTP_RESPONSE — 2026-10-18T00:00:00.000Z — módulo: httpx → <code>evidence-url-example</code> — URL — 2026-10-18T00:00:00.000Z</li></ul></td></tr></table><h2>Tecnologías relacionadas con hosts web</h2><table><tr><th>Host</th><th>Endpoint observado por linaje</th><th>Tecnología</th><th>Evidencia</th></tr><tr><td>example.invalid</td><td><code>https://example.invalid/</code></td><td>nginx</td><td><ul><li><code>evidence-technology-example</code> — TECHNOLOGY — 2026-10-18T00:00:01.000Z — módulo: fingerprintx → TECHNOLOGY — 2026-10-18T00:00:01.000Z → <code>evidence-http-response-example</code> — HTTP_RESPONSE — 2026-10-18T00:00:00.000Z</li></ul></td></tr></table><h2>Hallazgos candidatos relacionados con hosts web</h2><table><tr><th>Host</th><th>Endpoint observado por linaje</th><th>ID de candidato</th><th>Estado</th><th>Evidencia</th></tr><tr><td>example.invalid</td><td>Sin atribución a endpoint observado</td><td><code>candidate-finding-example</code></td><td>candidato; no confirmado</td><td><ul><li><code>evidence-finding-example</code> — FINDING — 2026-10-18T00:00:02.000Z</li></ul></td></tr></table><footer>Generado localmente por CHEF. scopeStatus: not_asserted.</footer></body></html>"
}
